{
  "schema_version": "1.0.0",
  "project_id": "dry-run-001",
  "created_at": "2026-09-21T11:00:00-03:00",
  "status": "complete",
  "qa_cycles": 0,
  "hook": {
    "text": "Pele ressecada, lábios rachados, ar seco de novo?",
    "duration_seconds": 2.8
  },
  "blocks": [
    {
      "order": 1,
      "text": "Esse mini umidificador USB solta uma neblina fresquinha e ainda deixa seu cantinho com luz de sete cores.",
      "duration_seconds": 6.4
    },
    {
      "order": 2,
      "text": "São 300ml que rendem até 8 horas, funciona no notebook, no power bank ou no carregador — e desliga sozinho quando a água acaba, sem bagunça, sem susto.",
      "duration_seconds": 9.6
    },
    {
      "order": 3,
      "text": "Silencioso, compacto e ainda vira parte da decoração da sua mesa.",
      "duration_seconds": 3.9
    }
  ],
  "cta_spoken": "Compra agora no TikTok Shop e acaba com esse ar seco na sua mesa, no quarto ou no carro.",
  "total_duration_seconds": 29.5
}
