{
  "schema_version": "1.0.0",
  "project_id": "dry-run-002",
  "created_at": "2026-09-22T14:15:00Z",
  "status": "complete",
  "qa_cycles": 0,
  "hook": {
    "text": "Sua mesa ainda tem aquela luz horrível?",
    "duration_seconds": 2
  },
  "blocks": [
    { "order": 1, "text": "Essa luminária articulada resolve isso em segundos.", "duration_seconds": 5 },
    { "order": 2, "text": "3 temperaturas de luz, USB-C, cabe em qualquer mesa.", "duration_seconds": 6 }
  ],
  "cta_spoken": "Link na bio, compre agora.",
  "total_duration_seconds": 13
}
